{
  "schemaVersion": "2.0",
  "targetLanguage": "en",
  "targetLocale": "en-US",
  "startBand": "A2",
  "bandOrder": [
    "A1",
    "A2",
    "B1",
    "B2",
    "C1",
    "C2"
  ],
  "bands": {
    "A1": {
      "passMark": 2,
      "writingPromptKey": null,
      "questions": [
        {
          "id": "en-a1-01",
          "type": "mcq",
          "instructionKey": "assessment.instruction.completeSentence",
          "stem": "She ___ a student.",
          "options": [
            "is",
            "are",
            "am",
            "be"
          ],
          "correct": "is",
          "concept": "verb.be-present"
        },
        {
          "id": "en-a1-02",
          "type": "mcq",
          "instructionKey": "assessment.instruction.completeSentence",
          "stem": "I ___ coffee every morning.",
          "options": [
            "drink",
            "drinks",
            "drinking",
            "drank"
          ],
          "correct": "drink",
          "concept": "verb.present-simple"
        },
        {
          "id": "en-a1-03",
          "type": "mcq",
          "instructionKey": "assessment.instruction.completeSentence",
          "stem": "She ___ to school every day.",
          "options": [
            "goes",
            "go",
            "going",
            "went"
          ],
          "correct": "goes",
          "concept": "verb.present-simple-3sg"
        },
        {
          "id": "en-a1-04",
          "type": "mcq",
          "instructionKey": "assessment.instruction.completeSentence",
          "stem": "She has ___ apple in her bag.",
          "options": [
            "an",
            "a",
            "the",
            "—"
          ],
          "correct": "an",
          "concept": "form.article-indefinite"
        },
        {
          "id": "en-a1-05",
          "type": "mcq",
          "instructionKey": "assessment.instruction.completeSentence",
          "stem": "One child, two ___.",
          "options": [
            "children",
            "childs",
            "childrens",
            "childes"
          ],
          "correct": "children",
          "concept": "form.plural-irregular"
        }
      ],
      "pronunciationItems": [
        {
          "itemId": "en-a1-p01",
          "text": "school",
          "ipa": "skuːl",
          "focusPhoneme": "s",
          "phonemes": [
            "s",
            "k",
            "uː",
            "l"
          ]
        },
        {
          "itemId": "en-a1-p02",
          "text": "happy",
          "ipa": "ˈhæpi",
          "focusPhoneme": "æ",
          "phonemes": [
            "h",
            "æ",
            "p",
            "i"
          ]
        }
      ]
    },
    "A2": {
      "passMark": 2,
      "writingPromptKey": null,
      "questions": [
        {
          "id": "en-a2-01",
          "type": "mcq",
          "instructionKey": "assessment.instruction.completeSentence",
          "stem": "Last night, she ___ a movie.",
          "options": [
            "watched",
            "watch",
            "watches",
            "is watching"
          ],
          "correct": "watched",
          "concept": "verb.past-simple"
        },
        {
          "id": "en-a2-02",
          "type": "mcq",
          "instructionKey": "assessment.instruction.chooseCorrectSentence",
          "stem": null,
          "options": [
            "She didn't go to school yesterday.",
            "She didn't went to school yesterday.",
            "She doesn't went to school yesterday.",
            "She not go to school yesterday."
          ],
          "correct": "She didn't go to school yesterday.",
          "concept": "verb.past-negation"
        },
        {
          "id": "en-a2-03",
          "type": "mcq",
          "instructionKey": "assessment.instruction.chooseQuestion",
          "stem": "I go to the gym three times a week.",
          "options": [
            "How often do you go to the gym?",
            "How many do you go to the gym?",
            "How much do you go to the gym?",
            "How long do you go to the gym?"
          ],
          "correct": "How often do you go to the gym?",
          "concept": "syntax.question-word"
        },
        {
          "id": "en-a2-04",
          "type": "mcq",
          "instructionKey": "assessment.instruction.completeSentence",
          "stem": "The party is ___ Saturday evening.",
          "options": [
            "on",
            "in",
            "at",
            "for"
          ],
          "correct": "on",
          "concept": "form.preposition-time"
        },
        {
          "id": "en-a2-05",
          "type": "mcq",
          "instructionKey": "assessment.instruction.completeSentence",
          "stem": "When I was young, I ___ ride a bike, but now I can't.",
          "options": [
            "could",
            "can",
            "would",
            "should"
          ],
          "correct": "could",
          "concept": "verb.modal-past-ability"
        }
      ],
      "pronunciationItems": [
        {
          "itemId": "en-a2-p01",
          "text": "watched",
          "ipa": "wɑtʃt",
          "focusPhoneme": "tʃ",
          "phonemes": [
            "w",
            "ɑ",
            "tʃ",
            "t"
          ]
        },
        {
          "itemId": "en-a2-p02",
          "text": "thirty",
          "ipa": "ˈθɝti",
          "focusPhoneme": "θ",
          "phonemes": [
            "θ",
            "ɝ",
            "t",
            "i"
          ]
        }
      ]
    },
    "B1": {
      "passMark": 2,
      "writingPromptKey": "assessment.writing.b1",
      "questions": [
        {
          "id": "en-b1-01",
          "type": "mcq",
          "instructionKey": "assessment.instruction.completeSentence",
          "stem": "I'm exhausted — I ___ worked twelve hours today.",
          "options": [
            "have",
            "had",
            "has",
            "did"
          ],
          "correct": "have",
          "concept": "verb.present-perfect"
        },
        {
          "id": "en-b1-02",
          "type": "mcq",
          "instructionKey": "assessment.instruction.completeSentence",
          "stem": "If it ___ tomorrow, we will cancel the trip.",
          "options": [
            "rains",
            "will rain",
            "rained",
            "would rain"
          ],
          "correct": "rains",
          "concept": "verb.conditional-first"
        },
        {
          "id": "en-b1-03",
          "type": "mcq",
          "instructionKey": "assessment.instruction.completeSentence",
          "stem": "You ___ try the local food — it's amazing.",
          "options": [
            "should",
            "must",
            "need",
            "would"
          ],
          "correct": "should",
          "concept": "verb.modal-advice"
        },
        {
          "id": "en-b1-04",
          "type": "mcq",
          "instructionKey": "assessment.instruction.completeSentence",
          "stem": "That's the woman ___ helped me find my bag.",
          "options": [
            "who",
            "which",
            "what",
            "whose"
          ],
          "correct": "who",
          "concept": "syntax.relative-pronoun"
        },
        {
          "id": "en-b1-05",
          "type": "mcq",
          "instructionKey": "assessment.instruction.completeSentence",
          "stem": "I'm really looking forward ___ the holidays.",
          "options": [
            "to",
            "for",
            "at",
            "of"
          ],
          "correct": "to",
          "concept": "lexis.phrasal-verb"
        }
      ],
      "pronunciationItems": [
        {
          "itemId": "en-b1-p01",
          "text": "weather",
          "ipa": "ˈwɛðɚ",
          "focusPhoneme": "ð",
          "phonemes": [
            "w",
            "ɛ",
            "ð",
            "ɚ"
          ]
        },
        {
          "itemId": "en-b1-p02",
          "text": "vegetable",
          "ipa": "ˈvɛdʒtəbəl",
          "focusPhoneme": "v",
          "phonemes": [
            "v",
            "ɛ",
            "dʒ",
            "t",
            "ə",
            "b",
            "ə",
            "l"
          ]
        }
      ]
    },
    "B2": {
      "passMark": 2,
      "writingPromptKey": "assessment.writing.b2",
      "questions": [
        {
          "id": "en-b2-01",
          "type": "mcq",
          "instructionKey": "assessment.instruction.completeSentence",
          "stem": "If I ___ more free time, I would learn to play the piano.",
          "options": [
            "had",
            "have",
            "would have",
            "was having"
          ],
          "correct": "had",
          "concept": "verb.conditional-second"
        },
        {
          "id": "en-b2-02",
          "type": "mcq",
          "instructionKey": "assessment.instruction.completeSentence",
          "stem": "The new bridge ___ last month.",
          "options": [
            "was completed",
            "completed",
            "has completed",
            "is completing"
          ],
          "correct": "was completed",
          "concept": "syntax.passive"
        },
        {
          "id": "en-b2-03",
          "type": "mcq",
          "instructionKey": "assessment.instruction.chooseMeaning",
          "stem": "The conference has been put off until next month.",
          "options": [
            "postponed",
            "cancelled",
            "moved forward",
            "shortened"
          ],
          "correct": "postponed",